email_subject,email_text
IT Update: security of Revenue-Producing Systems ,"In our continuing effort to provide security and stability to the revenue-producing systems here at EES, we would like to ask for your assistance with a few items.  In general, we want to ensure that all business critical systems are clear from the risk of downtime, which could negatively impact the business.

So, what does this mean to you?  We need to make sure that any computer programs and files you use to do your job are protected and reside in an environment that is controlled by the IT infrastructure group.  This serves several purposes, including:

Ensuring that everything business critical is backed up properly and can be recovered if a workstation's hard drive fails.
Ensuring that specialized programs like Cobra or BSOC or RPS or RGS which are business critical can easily be installed on any workstation by the IT group.  This will help keep the business up and running if you have to switch workstations suddenly.

Specialized applications - If you use any special program to do your work, such as WinAT or some other database, analysis, or special utility tool, the IT infrastructure group should be made aware of it so that they can learn how to install and maintain it.  This way, if an elephant sneaks into the office one night and steps on your computer, we can build out another workstation, install the specialized programs on it for you, and deliver it to you so that you can continue to do your job.  Please contact Christine Nguyen at (713) 345-8459 if you think your computer application is not currently maintained by IT.

Files: Spreadsheets, Excel macros, MS Access databases, and the like - Please make sure that any spreadsheets or MS Access databases you use for the business are not stored on your local computer drives.  These files should be stored on a network-shared drive (in general, something other than C or D drive).  That way, if that elephant comes back another night, we could get you another workstation from which to operate without losing any of your valuable work.

Web sites - If you are responsible for maintaining a web site that is business critical, including those used by inside as well as outside customers, we need to make sure that this web site is hosted on one of the fault-tolerant redundant web servers provided by IT infrastructure, and not running on a laptop tucked away under your desk.  This will help keep the web site available to those who need it in the event of power outages, server failures, and other unforeseen hardware-related problems.  Please contact Larry Hack at (713) 345-5783 if you think your web site is not currently maintained by IT.

Your support with this effort is greatly appreciated."
Contact Info ,"Richard, thanks for taking the time to network with me.  I have attached
information about my Partner Lynn Brondos and me; Also, please find a
position description.  

 <<Product Risk Managment.doc>> 

Francisco Rivera, CPC

RWS PERSONNEL, INC.
Power Industry Executive Search
700 Ackerman Rd, Suite 390
Columbus, OH 43215
tele 614.358.1594
"
 ,"Black dot is what I would need.  The two concerns I have is shaft flex (I would actually prefer steel shafts) and the price (I'm broke).  I appreciate your willingness to work with me but even though your price is fair, I simply can't afford it.  Let me know how much you would be willing to come off but I have to warn you even if you ask $600 it would be hard for me to come up with.
Thanks again for keeping me in mind.
Drew"
Riverside Contract Status ,"I have not had a chance to get to it.   I am sorry.  Maybe on Friday.

C"
Lay It On the Line Survey Results ,"Recently, I asked you to ""Lay It On the Line"" and tell me what you believe are the most critical issues that we need to address.  Many of you responded, and I want to share the survey results with you.  Additionally, I want to share with you the things we are currently doing or plan to do to move Enron forward.

First, let's take a look at the survey results.

In just three days, more than 4,000 employees completed the survey.  I sincerely appreciate your participation.

I.  We asked you to identify the top five issues facing Enron today.  The responses were:

1.	Stock price
2.	The PRC
3.	Employee/internal morale
4.	External reputation and image
5.	""Walking the talk"" of integrity and respect


II.  We asked you general questions about working at Enron, comparing 2001 to 2000.


	% of employees responding
	strongly agree/agree:
I am committed to staying at Enron.	64.1%
Enron is a company I would invest my money in.	60.1%
I am treated with respect.	60.0%
I would recommend Enron as a place to work for friends and family.	59.1%
I have talents and skills that Enron is not fully utilizing.	54.7%
Enron truly encourages people to take risks.	47.5%
My immediate supervisor has a clear view of where Enron is going and how to get there.	46.6%
Executive management has a clear view of where Enron is going and how to get there.	41.6%

III.  We asked you to what extent you would associate the following attributes to Enron, comparing 2001 to 2000.


	More	Same	Less	N/A	
Concerned for communities	34.5%	44.9%	10.3%	10.3%	
Innovative	30.8%	35.7%	24.6%	8.9%	
Entrepreneurial	28.5%	37.8%	23.7%	10.0%	
Ethical	17.0%	45.1%	28.1%	9.8%	
Trustworthy	14.9%	39.0%	36.9%	9.2%	
Arrogant	39.1%	32.4%	13.3%	15.2%	
Self-serving	41.9%	38.6%	7.5%	12.0%	



IV.  Finally, we asked you to identify the top three things you like about working at Enron.

1.	People (the high quality of people at Enron was the most widely-cited aspect):
-	talented
-	creative
-     learn from one another
2.	Culture and reputation:
-	innovative spirit
-   willingness to be aggressive and take risks
-   ability to embrace change
-   involvement in community
3.	Work environment:
-	pay and benefits
-   true meritocracy
-   unlimited opportunities



The results of our survey confirmed for the Management Committee and me the great things you feel about Enron and also what you see as the issues we must address to move Enron forward.  The following are some of the things we're doing now or going to do in the next few days and weeks to address the top five issues you identified.  Keep in mind this is only the beginning of an ongoing effort to address your concerns and engage your feedback.

Now, here's what we're going to do based on your feedback.

STOCK PRICE

We are all concerned about our stock price, which has declined significantly this year.  The primary reasons for the sharp decline from our highs earlier this year include:
-	A decline in the overall market and economy;
-   Certain Enron-specific issues, such as California, India and recent management turnover;
-   A ""meltdown"" in the broadband sector, which may have been as much as $30-$40 of our stock price at the high;
-   Lower energy commodity prices and volatility relative to last winter's high; and
-   Concerns over the pace of energy deregulation.

These concerns mask the strong underlying recurring earnings growth in our transportation and distribution, wholesale and retail businesses.  Very few companies have demonstrated the earnings growth, and future earnings growth, as has Enron.  We fundamentally believe that if we focus on continued earnings growth and reestablishing the confidence of our financial investors, our stock price will reflect the value these businesses deserve.

	Over the past month, we have met with all of our major institutional shareholders and all of our analysts, reviewing the strong prospects in each of our businesses.
-	We have also committed to provide more segmented information about our business units and how we operate so that analysts have a better understanding of our businesses and how we make money.
We also want to make sure that employees know what we are doing going forward:
-	Mark Koenig, executive vice president of Investor Relations, will host Brown Bag sessions with groups of employees to discuss stock price issues and answer questions.  He will also continue to host eSpeak sessions to answer employee questions.
- Greg Whalley, Mark Frevert and I will also hold discussions with various groups of employees, which will be taped and made available to employees worldwide.  Watch for these events.

THE PRC

The relative discussion of talent is absolutely critical to maintain our business and our meritocracy.  Understanding which employees have demonstrated the greatest contribution and behaviors, which individuals should be given greater responsibility and leadership, and identifying our top and bottom talent are essential to achieve our business objectives.  Nevertheless, we recognize that certain aspects of the PRC may have caused some of you concern, and we believe we can improve, refine, streamline and better clarify the process objectives for everyone.

Therefore, we will make the following changes to the PRC process prior to year-end:
-	Effective immediately, relative performance discussions will occur annually at year-end.  However, business units will have the flexibility to determine if they need to have those discussions more frequently.
-    The current preferred distribution will no longer be required across Enron.  Business units will be asked to identify only their top 10% and bottom 10% performers for review by Enron's Office of the Chairman annually at year-end.
-   We will continue to use the PEP 360 degree feedback system as input into performance feedback once a year for all employees.  We will also reinforce to all supervisory employees the absolute necessity of continual communication and feedback to their direct reports throughout the year.
-   Finally, we have formed an employee task force that will give us feedback on future changes.

In the November issue of Enron Business, we will feature the first in a series of articles discussing our performance evaluation process.  In addition, there will be other communication and training that will occur prior to year-end.

EMPLOYEE MORALE

We believe the stock price, our external reputation and the performance review process have all affected morale.  Additionally, some employees have indicated they do not feel that they have a place to go to voice their ideas and concerns.  Effective immediately, we will provide an additional resource for employees who do not currently feel comfortable going to either their supervisor or their Human Resources (HR) rep.
-	We are establishing a new business function we are calling Employee Relations (ER) that will report directly to the Office of the Chairman.  Cindy Olson will head this function.  More details of how this group and HR will operate will be communicated in the next few days.
Over the long term, we want our managers to address employee issues and concerns and therefore are providing the following leadership training for those with supervisory roles.
-	We will encourage vice presidents and above, as well as other current and emerging leaders, to complete Executive Impact & Influence training.  These sessions are designed to improve leadership skills such as coaching and effective communication that have a direct impact on performance and managing people.
-	Additionally, we will encourage every employee with supervisory responsibilities to complete online communications training via Communicate!, which will be rolled out immediately.  Communicate! is an interactive training course that uses Enron scenarios and a combination of video, voice mails, e-mails and meetings notes, to analyze user performance based on a participant's responses and actions.

EXTERNAL REPUTATION

We all recognize that our external reputation has suffered this year.  The single most important factor that influences our reputation is our actions - how we act and how we communicate those actions as a company and as individual employees.  We recognize that as Enron's ambassador's in the marketplace, the more you know about our strategy, performance and challenges, the more you can help disseminate accurate information about our company.  To ensure you are better informed:
-	We will do a better job providing you with timely information about issues affecting Enron.  In addition to our existing communication efforts, like e-mail messages and internal publications eBiz and Enron Business, we will post a Q&A on current issues on the Enron intranet at home.enron.com <http://home.enron.com>.  This will give us a consistent message across the organization and will equip you with information when talking to your customers.
- As we said before, Greg, Mark and I, as well as members of our Management Committee, will meet with groups of employees across Enron to hear your thoughts and share with you our business direction and challenges.  Look for these to start in mid-October.

INTEGRITY & RESPECT

I believe, as I said previously, we need to reinforce our core values, particularly integrity and respect.  From what you have told us in this survey, you agree.
-	Enron's values will have more importance in each employee's evaluation and feedback.  We ask that all employees, regardless of level, hold themselves accountable for the way they interact with people on a daily basis.  We are all responsible for how we treat our coworkers and customers.
-	We will also conduct employee focus groups on a frequent basis to gather additional, specific feedback on employee issues like ethics, integrity and individual concerns.  If you would like to participate in these focus groups, please send an e-mail to Cindy Olson.
-   Periodically, I will host a special feature column in Enron Business to keep you informed of the action steps we are taking and their results.

Finally, I give you my commitment that we will do a better job giving you more information regarding Enron's strategy and challenges, and listening to your concerns and ideas.  But we would ask for your commitment, too.  We need your dedication to Enron and its values, as it is only through your commitment that we will achieve long-term success.  We will conduct another employee survey early next year.  Please continue to send me your feedback and let's continue to work together and keep Enron one of the best places to work in the world."
 NEW! Retail Weather Risk Management Products ,"Theater 1
Weather-Risk Management for the Cold Beverage Industry
A cool summer can put a chill on profits for manufacturers and retailers of non-alcoholic cold 
beverages. Enron's new retail weather-risk management product provides compensation for 
lost revenue due to cooler than normal summer temperatures or a shorter than average summer
season.  The structures are based on customers' historic financial information and National
Weather Service data. To learn more, click here .


Theater 2
Weather-Risk Management for the Atlantic City Gaming Industry
When snowstorms sock in on the New York-Philadelphia corridor, Atlantic City casino patrons 
don't make it to the tables, the slot machines are quiet-and the revenue losses can be significant. 
Enron's new retail weather-risk management product can provide compensation for lost revenue 
in exchange for annual premiums, with the structures based on casinos' historic financial 
information and National Weather Service data. To learn more, click here ."
Electronic Pay Stubs ,"Get ready.  Beginning in November, electronic pay stubs will be available to all employees who have their paychecks direct deposited into their bank account.  Electronic pay stubs are an easy, fast, and efficient way for you to get your payroll information.  They will also help Enron to realize a considerable savings in time and dollars spent over traditional printed pay stubs.

If you prefer to receive a hardcopy of your pay stub, click on the link below to complete a request form.  This form must be submitted to Payroll by October 15, 2001.  Unless you submit a form your pay stub information will default to electronic viewing.  

Please click on the link below.
	
Name:             RICHARD RING
Personnel number: P00506973
Phone:            7138533561	
		
If you have questions about electronic pay stubs, please contact Janice Priddy (Payroll) 713-853-7839 or Marie Newhouse (ClickAtHome) at 713-345-4185 or send an email to  (Enron Payroll in Outlook).

Stay tuned for more details in the coming weeks."
Party for Larry Fenstad ,See attached invitation for Larry Fenstad's retirement party.
NEW! Energy Efficiency Management for Texas ,"Introducing products that help our Texas customers cut their energy usage
and lets Enron share in the savings.

Enron's Energy Efficiency Management services improve the efficiency of our customers' equipment, systems, 
and operations. Light industrial and commercial customers can save up to 22% when Enron implements the 
conservation projects we propose. There's a standard list of projects that we offer and deliver on a scaleable 
delivery platform. The customer uses less energy, shares the savings with Enron, and everybody wins."
FTRs Allocation ,"Hi richard,
can you find out or have michele find out as much as we can about obtaining FTRs and the various issues regarding that with regards to.. time lines and logistics and our rights as LSEs.
It is becoming more and more apparent that we could save a lot of money by physically serving the load that we have in PJM if we get FTRs allocated to us. As a part of the new auction that the Jersey utilities are having we might be able to get some things done that might not have been possible as an LSE  like getting FTRs from locations that we choose and such
I would like to see if we can start puting pressure on them next weekif we can get our information gathering done this week then we will be in shape to meet with our govt affairs people maybe next week.. if we have to.
Also as a side note any information on how we can request capacity for the transmission that we requested 15 to 20 days ago for 2004???

thanks."
 RE: PJM_UCAP ,"at best i will remove all the bids on the table and give them one for 120mws 45$ bid for planning year jun02-may03.
-narsimha"
RE: Unforced capacity credits ,"Thanks for that, I have a couple of other time periods for this same customer.  They are naturally long and I think I could work something out if you guys are natural buyers.  The other 2 periods are: Jun-Dec02 (starting one month later than your last quote)
The other period is the PJM planning year Jun02-May03.  The amount could be higher if that works for you guys.  Let me know if you want to do more than 100 MW and I will see what I can do.  Nick"
RE: PJM UCAP May-02 thru Dec-02 ,48$ bid.. interested in all of it100mws..
RE: Unforced capacity credits ,This is a different counter-party that is looking to sell 50-100 MW from May-Dec02.
 RE: Unforced capacity credits ,"I will try and get a response from my customer today, also is there interest downstairs for UCAP in PJM from May-Dec02?  Nick"
RE: Unforced capacity credits ,"Thanks for the price, he will look at it and get back to us.  Also do you have an idea where ICAP in New York Zone J is trading for the next couple of years, (Cal02 and 03)?  Nick"
 New Email Address ,"We have just launched our ""New & Improved Website"",
www.newbedfordchamber.com
 and I have a new email address:



Please make the appropriate changes in your email address book.

Thank you,

Jim Mathes, President
New Bedford Area Chamber of Commerce"
2001 Special Stock Option Grant Awards ,"We are pleased to present you with a 2001 Special Stock Option Grant Award.  As a participant in this grant you have the opportunity to share in the ownership of Enron and the potential profit from increases in the value of Enron's common stock.

The 2001 Special Stock Option Grant was made to let you know how valuable you are and to recognize your contributions in making Enron the great company it is today.   Although there are no guarantees as to Enron's future stock performance, we believe that an Enron stock option has tremendous future growth potential.  The value you ultimately receive from your options will depend on the price of Enron stock at the time you exercise your options.  

You can access your 2001 Special Stock Option Grant Agreement and the Stock Plan document governing the grant via your eHRonline account on the intranet website at http://ehronline.enron.com.  Unlike stock options granted in the past a copy of your grant agreement will not be mailed to your home address.  

Additionally, the following information regarding the 2001 Special Stock Option Grant can be found on the HR website 

?	2001 Special Stock Option Grant Highlights
?	2001 Special Stock Option Grant Frequently Asked Questions (FAQs)
?	A ""How to Exercise Options"" document that contains contact information and PaineWebber forms applicable to your stock options

Please take time to review this material.  It is important to us and to you.  If you have any questions, please contact your Human Resources representative."
 Organization Changes ,"Today, we are forming Enron Global Services (EGS) in order to more closely align our asset-based businesses.

This reorganization will allow EGS to focus our resources on opportunities that present the highest value to Enron.  It will also accomplish the following:  1) enhanced synergies among our assets and personnel, 2) more effective prioritization of business opportunities, and 3) better management of Enron's asset-based businesses throughout the world.

Enron Global Services' energy asset portfolio includes the North American pipeline businesses of Enron Transportation Services (ETS), including Northern Border; the international pipeline, power and distribution operations of Enron Global Assets & Services (EGAS); Portland General Electric; EOTT Energy Corp; Enron Wind; Azurix and Wessex Water.  

Reporting to me as the heads of their respective business units are:
?	Jim Hughes, President & COO - EGS International
?	Danny McCarty, Managing Director & CCO - ETS
?	Bill Cordes, President - Northern Border Partners
?	Peggy Fowler, President & CEO - Portland General Electric
?	John Garrison, President & CEO - Azurix
?	Dana Gibbs, President & COO - EOTT Energy Corp
?	Colin Skellett, CEO - Wessex Water
?	Adam Umanoff, President & CEO - Enron Wind

With the creation of EGS, we hope to enhance the efficient utilization of our commercial support services.  To accomplish this, EGS' staff and operational functions will be headed by:
?	Rod Hayslett, Managing Director & CFO 
?	Rob Walls, Managing Director & General Counsel 
?	Phil Lowry, Managing Director, Pipeline Operations and Engineering & Construction
?	Brian Stanley, President & CEO - EEOS
?	Steve Hotte, Vice President & CIO
?	John Ambler, Vice President, Communications & PR	
?	Gary Smith, Vice President, Human Resources

In addition, Rob Walls will continue to perform his role as Deputy General Counsel for Enron reporting to Jim Derrick.

Phil Lowry will be responsible for domestic pipeline operations, technical services and engineering & construction, as well as, international pipeline technical services and engineering & construction.  Brian Stanley will be responsible for technical services and engineering & construction for international power and distribution facilities.  

Below is an organization chart for Enron Global Services, which displays the changes described here.  We are confident this new organization will focus our talent and capital appropriately.  Please join me in supporting this management team as it strives to maximize Enron's return on its assets.

 "
"FW: Electricity Is Not Cyclical, Kit Konolige, MS Electric Utilities
 Research  COURSE OFFERING Finance for Non Financial Executives ","Where:	Granger A, Doubletree Hotel, 400 Dallas, Houston, Texas
When:		October 3-4, 2001     8:00am-5pm


Finance is the universal language of business  the language of goals, objectives, and results.

Today's managers need to have ""finance savvy"" in order to get ahead and stay ahead.

You've got to know how to justify requestsquantify your contributions to the organizationspot profit drains before they get out of hand.

Check out elm.enron.com and sign up now!"
