email_subject,email_text
Financial to Physical Switching ,"I wanted to give all of you an update on the process of switching accounts from financial to physical, and a data collection effort to provide necessary information to facilitate this process.

Financial to Physical Switching

I will be working with Operations and Services Managment to better define this process over the next couple of weeks, in the meantime, here is the interim process:

Develop a list of accounts that are currently being served financially that you want to switch to physical service.  Include at least the account name, account number, and utility name.  Please screen the utility name to make sure that we are capable of physically serving that utility within the next 45 days.  Be aware that customer contractual obligations or utilty tariff rules may substantially delay our ability to serve the customer physically.
Send this list of accounts to David Salley in Services Management, copy me and Scott Massey on the email.
David will review the accounts for contractual obligations and other necessary information and forward to Jay Bhatty in Operations.
Jay will perform the necessary steps to send the request to CSC.
CSC will create the DASR (Direct Access Service Request) and send it to the appropriate utility to initiate the switch to physical.

Customer Data Collection Project

I have asked Services Management to undertake a data collection process on all our existing accounts.  Scott Massey is responsible for this effort.  The primary purpose of this it to identify all of our accounts and to have enough information to make economic decisions on switching customers from financial to physical.  This data collection project has been combined with a P&L project begun in Illinois.  The attachment below describes this project in more detail and includes the data to be collected.

Please copy me on any further requests for existing customer data so that we can eliminate duplicate requests.

Thanks,
Jeff"
 RE: BGE Index Product - Change to LMP BGE Zone Index ,"Narsimha,

Good point, and the key is that BGE's standard offer includes a $7 ""retail adder"" to the market-based price.  This retail adder was part of BGE's settlement agreement.  To the extent all of our deal costs (including a scheduling fee) and origination margin are notably less than $7, then customers will be better off under our index product.

Bob"
 RE: BGE Index Product - Change to LMP BGE Zone Index ,"fyiThere is a scheduling fee that needs to be added to the deal costsand just for my curiosity what is the reason why the customer would switch to us instead of staying with the incumbent utility with this product??? isn't this exactly the SO product being offered by the utility without the origination margin???
-narsimha"
 RE: BGE Index Product - Change to LMP BGE Zone Index ,"Narsimha Michele,

Thanks for helping us with this index product issue.

We were initially planning to use an East Hub index with a basis of all uplifts, but Gillian and I agree with you on the advantages of using an index of PJM LMP zonal prices including all uplifts.  The product will certainly be more comparable to BGE's standard offer pricing, and it will eliminate the basis risk that you would have had with the East Hub index product.  A BGE zone index product will also eliminate the price comparison issues we had due to congestion.  

Based on today's discussion we will modify the design of the BGE index product proposal to reflect a pass-through of LMP BGE zone prices and uplifts.  The basis for this product would simply be deal costs and origination margin.

Gillian and I will work with Berney's group on changes to the TC, and a modified Product Approval Template will be routed soon.

Thanks again,
Bob"
MA Accounts List ,"Hey Dick,

Here's the info you requested."
South Coast Electric Power Group Bidders Conference ,"This notice is to invite you to participate in a Bidders Conference offered
by the South Coast Electric Power Group (SCEPG).  The Bidders Conference
will be held on Thursday, September 27, 2001 beginning at 9:00 AM in the
Grand Ballroom at White's Regional Hospitality Center, Route 6, Westport,
MA.  You are invited to arrive at 8:30 AM for coffee and danish.

The SCEPG is made up of large users of electricity in the service areas of
the New Bedford Area Chamber of Commerce and Fall River Area Chamber of
Commerce.  As of today, nearly 30 companies and orgainizations representing
almost 300,000,000 KWH of annual use and more than 50,000 KVA Demand Peak
are participating in the SCEPG.  The group will likely grow by the date of
the Bidders Conference.

At the Bidders Conference, you will receive an RFP inviting you to bid on
SCEPG members electricity needs.  Every SCEPG member will have a
representative at the Bidders Conference to sign your release forms to
obtain account information from their respective utilities.  They have been
instructed to bring a complete listing of all of their accounts and service
addresses, which can be attached to your release forms.

Please bring a minimum of 50 of your release forms.

Please confirm your planned attendance at the Bidders Conference via return
email tonbchamber.com

Thank you.

Jim Mathes, President
New Bedford Area Chamber of Commerce"
Retail Energy Foresight  FREE Trial Issue ,"Dear Colleague:

Need information on retail energy markets?

Retail Energy Foresight, a bimonthly publication with switch rate
predictions and thoughtful analysis, is what you need to understand
today's volatile retail energy markets.

Download FREE trial issues from XENERGY's web site at
http://www.xenergy.com/XENHOME.nsf/HTMLDocs/3B_Foresight

Every issue of Retail Energy Foresight presents:


 > Switch rates by utility service territory and customer class
from around the nation;

> Predictions of switch rates for Pennsylvania, Illinois, and
other markets;

> An intimate look at markets and related topics; this month read
about Market Backwaters and potential for revival;

> All of the above served up with our own brand of humor to make
retail energy markets actually fun to read about.


Take a look at what Retail Energy Foresight has to offer.  We think
you'll agree it's a valuable and unique analysis publication, and
hope that you're tempted to subscribe.  To do so, print out and fax
back the order form on the last page of any issue (from our Web
site) or call me at 781.273.5700 x387.

Regards,

Susan Weber
Editor - Retail Energy Foresight
sweber@xenergy.com
Tel. 781.273.5700 x387
Fax 781.273.9368


About Us:  Retail Energy Foresight is published by XENERGY, an
energy consulting firm with 25 years experience, specializes in
understanding the retail energy markets. With the help of our
clients, we have invested over $8 million studying retail energy
markets, making us uniquely qualified to provide the analysis and
predictions you need to thrive in this new arena.

If you would like to have your e-mail address removed from this
mailing list, please reply with ""remove name"" in the subject field."
saturday get together ,"i thought i'd have a little get together on saturday if you guys are interested.  a little celebration to welcome michelle and vin down to houston.  nothing big - figured we would cook out or something, then either hang out and drink at my house or head out downtown to party.  we would start around 6 pm.  bring your significant others.  i think everyone knows where i live, but just to be on the safe side directions are below.

take smith street south.  turn right on drew.  cross brazos, bagby, and baldwin.  the house is on the right immediately before helena.  it's 207 drew street.  my phone number is 713-523-0170."
Farwell to Enron ,"All,

I am writing to thank everyone for the great
experience working together both in Houston and in
London.  I will be pursuing opportunities outside of
Enron.  My contact details are below.  Please keep in
touch.

Sincerely,

Dung Tran


2941 Crawford Street
Houston, TX 77004 USA
HOME: 713-571-8688
MOBL: 832-439-6003
EMAIL: dtran2149@"
EES Product Management Announcement ,"You've Got Some Great Ideas-We're Banking On It!
Ever had a great idea for an EES product or service that you wanted to share? Now you can, through the new Product Idea Bank. At the Product Idea Bank, you can ""deposit"" ideas for direct review by the EES Product Management Team.

We know that everyone at EES has great ideas, so the Product Idea Bank is open to everyone. And if your product idea is selected and launched, you'll get more than just the satisfaction of a job well done-you'll get company-wide recognition.

The Product Idea Bank is easy to use. Just visit http://home.ees.enron.com/vision/comm/ideabank,  which is accessible from the EES home page. Fill out the brief form, click on the submit button, and you're done!

Remember-don't let your product ideas go undiscovered. Bring them to the Product Idea Bank.

Note: The Product Idea Bank works best with Internet Explorer."
FW: PIRA's Gas Flash Weekly 09/05/01 ,"Attached is PIRA's latest ""Gas Flash Weekly.""

If you have any questions regarding the report's content, please
contact: Greg Shuttlesworth (email: greg@pira.com), Tom Howard (email:
tazh@pira.com), Richard Redash (email: Rich@pira.com), Nobu Tarui
(email: nobuo@pira.com) or Jane Hsu (email: jane@pira.com), at (212)
686-6808. 

Contact Client Services regarding PIRA report distribution and address
changes at (212) 686-6808, email: support@pira.com.

NOTE: Circulation of the ""Gas Flash Weekly"" outside a Client's licensed
distribution area is strictly prohibited. Clients that are unsure of
their licensed distribution or require an extension of their current
license should contact their PIRA sales representative, or email to
sales@pira.com.

PIRA Energy Group"
FW: Golf Tournament ,Do you want to play in this scramble - I've played the last two years - dinner and prizes includedLet me know.
 FW: PIRA's Monthly Gas Forecasts 08/24/01 ,"Attached is PIRA's latest ""Monthly Gas Forecast.""

If you have any questions regarding the report's content, please
contact: Greg Shuttlesworth (email: greg@pira.com), Tom Howard (email:
tazh@pira.com), Richard Redash (email: Rich@pira.com), Nobu Tarui
(email: nobuo@pira.com) or Jane Hsu (email: jane@pira.com), at (212)
686-6808. 

Contact Client Services regarding PIRA report distribution and address
changes at (212) 686-6808, email: support@pira.com.

NOTE: Circulation of the ""Monthly Gas Forecast"" outside a Client's
licensed distribution area is strictly prohibited. Clients that are
unsure of their licensed distribution or require an extension of their
current license should contact their PIRA sales representative, or email
to sales@pira.com.

PIRA Energy Group"
"Re: Edison Electric Institute ""Master Agreement"" ",oh so sorry.  Slipped my mind.  Karen
Data requirements for enrollment ,"Richard,

The attached is the latest and greatest dealsheet and is what is completed and submitted to CSC to enroll customers for physical serve.  Let me know if you have any questions.

 

Rebecca"
Digital ID request confirmation ,"Dear RICHARD D RING,

Your administrator is processing your Digital Certificate.
You'll be notified when the certificate is ready to download.

If you have questions about your application, please contact
your Administrator by replying to this e-mail message."
"Environmental, Health and Safety Web Site ","The new EHS web site has now been launched. 

It is new and improved with increased functionality and usability. You can now go to the homepage and find the latest EHS and Corporate Responsibility news, as well as the latest documents posted to the site. Also, the homepage displays events and initiatives that are currently taking place within EHS.

In addition, the site contains a section that covers Global EHS regulatory and legislative information. This service is provided by EnHeSa, a global EHS consulting group. This section provides a legislative and regulatory calendar, legislation and regulations that could directly impact Enron and some analysis of these impacts. You can reach this section at http://ehs.corp.enron.com/Main.asp?Topic=EnvStratRescs&SubTopic=6&Ecobytes=   

Thanks,

Gavin Dillingham
Environmental Specialist
Enron Corp.
713-345-5961"
New Dialing Instructions ,"Effective Saturday, August 18, the access code for remote locations will be modified within the Enron Building phone system to reflect a standard utilized by all Enron phone systems.  The modification will change the first digit dialed when accessing the tie lines by using the Alternative Routing feature from 7 to 8.  As all other Enron phone systems currently access the tie lines with the digit 8, the change from 7 to 8 will only affect users who reside in the Enron Building.  All other Enron phone system users should note that several digits of the tie lines to London, Calgary, and Portland have changed.
 
What This Change Means To You
 
Effective Saturday, August 18, you must replace the first digit 7 with an 8 when accessing the tie lines.  Additionally, several of the digits to the London, Calgary, and Portland tie lines have changed.  All other digits of existing access codes will remain the same.  For your reference, a list of the new dial strings for remote locations is identified at the bottom of this message.  Please Note:  This change also means that any Auto-Dial buttons you use to call associates at remote locations will now have to be re-programmed.  Such buttons may be programmed on conference room phones and FAX machines in your area.
 
To re-program an Auto-Dial button:
 
?         Press the Menu button on your soft keys
?         Press the Program button on your soft keys
?         Press the Auto-Dial button you wish to program
?         Dial the new Dial String (as identified below)
?         Press the # key
 
REVISED DIAL STRINGS FOR ENRON TIE LINE NETWORK
Users must dial 8 digits to call via Tie Lines
 "
Enron Center Garage ,"The Enron Center Garage has opened.

Employees who work for business units that are scheduled to move to the new building and are currently parking in an Enron Contract garage or on the parking waitlist you are being offered a parking space in the new Enron Center garage.

This is the only offer you will receive during the initial migration to the new garage. Spaces will be filled on a first come first served basis. The cost for the new garage will be the same as Allen Center garage which is currently $165.00 per month, less the company subsidy, leaving a monthly employee cost of $94.00.

If you choose not to accept this offer at this time, you may add your name to the Enron Center garage waiting list at a later day and offers will be made as spaces become available. 

The  Sky Ring  that connects the garage and both buildings will not be opened until summer 2001. All initial parkers will have to use the street level entrance to Enron Center North until  Sky Ring access is available. Garage stairways next to the elevator lobbies at each floor may be used as an exit in the event of elevator trouble. 

If you are interested in accepting this offer, please reply via email to Parking and Transportation as soon as you reach a decision. Following your email, arrangements will be made for you to turn in your old parking card and receive a parking transponder along with a an information packet for the new garage.

The Parking and Transportation desk may be reached via email at Parking and Transportation Corp Enron or 713-853-7060  with any questions. "
Customer Account #'s ,"Hello Victor,  
 
My name is Vini Adenwala, I'm doing some research for Narsimha Misra and Richard Ring for the East Power Risk Mgmt. Dept., and I wanted to ask you  for some information regarding our customers in Massachusetts.  I have a list of contracts here:

1. Polaroid Corporation
2. Quebecor Printing USA Corp.
3. Simon Property Corp.
4. Sonoco Products Co.
5. Lucent Technologies Inc.
6. Haverhill Police Station
7. BICC General Cable Industries, Inc.

What I need to get from you is a customer list along w/ their account #'s for each of these contracts, and Richard told me you were the person I should talk to.  If you could provide me with a list of the individuals responsible  for billing each account, or even the customer acct. #'s themselves, I would greatly appreciate it.  Thank you for your time and cooperation.

Regards,

Vinay Adenwala"
Stay in Touch ,"I'm still holding on by a thin thread here in Portland, but I wanted to send you my vitals as I'm experiencing advanced symptoms of the travel bug. Needless to say, you're one of the major reasons I have no regrets about having worked at Enron. Definitely stay in touch.

Elliot

Elliot Mainzer"
Coffee Break? ,"Hey Laura,

I could really use a caffeine boost right about now. Would you be up for a quick coffee break at Starbucks in 15 minutes? It'd be great to catch up and discuss Project.

Let me know if that works for you!

Best,
Matt"
Happy Hour Anyone? ,"Hey Team,

It's been a busy week, and I think we all deserve a little break. How about we unwind together with a happy hour session after work today? I've heard that First Watch has some great deals going on.

Let me know if you're interested and we can coordinate the details.

Cheers,
Matt"
Need Your Expertise! ,"Hey James Jones,

Hope you're doing well! I've been trying to solve this puzzle at work, and I could really use your expertise. Would you mind sparing some time to brainstorm with me over a cup of coffee this weekend?

Looking forward to catching up and picking your brain!

Best,
William"
Quick Check-In ,"Hey Laura,

I hope your day is going smoothly! I wanted to check in quickly about the Project. Do you have a few minutes to chat sometime today to go over the latest updates and next steps?

Let me know when works best for you.

Thanks,"
Let's Catch Up! ,"Hey James Jones,

It's been too long since we last caught up! How about we grab lunch this weekend and fill each other in on what's been happening in our lives? I've been dying to hear about your recent adventures.

Let me know if you're free and we can make plans.

Take care,
carter"
Team Outing Ideas ,"Hey Team,

I hope you're all having a great day! I've been brainstorming some ideas for our next team outing and wanted to get your input. Do you have any suggestions or preferences for activities or venues?

Let's make sure it's something everyone will enjoy!

Looking forward to hearing your thoughts.

Best,
William"
Need Your Opinion ,"Hey James Jones,

I hope you're doing well! I'm facing a bit of a dilemma and could really use your opinion on something. Do you mind if we chat sometime soon? Your perspective always helps me see things more clearly.

Let me know when you're available.

Thanks a bunch,
William"
Follow-Up on Our Meeting ,"Dear Jack,

I hope this email finds you well. It was a pleasure meeting with you earlier today. I wanted to thank you for taking the time to discuss [topic of discussion]. It was insightful, and I appreciate the opportunity to learn more about [their company

As per our discussion, I will [action item or next steps]. Please feel free to reach out if you have any questions or require further information.

Looking forward to the possibility of working together.

Best regards,"
Confirmation of Proposal Submission ,"Dear Jack,

I hope this email finds you well. I wanted to inform you that we have successfully submitted the proposal for [project or opportunity] as discussed. We believe our proposal encapsulates the essence of our capabilities and how we can contribute to [their company].

Please don't hesitate to contact me if you require any additional information or clarification regarding the proposal.

Thank you for considering our proposal.

Best regards,"
Request for Information on Splunk ,"Dear John,

I hope you're doing well. I am writing to request more information about [specific product] offered by your company. We are currently evaluating potential solutions for [specific need or problem], and your product seems to align with our requirements.

Could you please provide details regarding features? Additionally, any case studies or testimonials would be greatly appreciated.

Thank you in advance for your assistance.

Best regards,"
Inquiry Regarding Potential Partnership ,"Dear Kayle,

I hope this email finds you well. I am reaching out to explore the possibility of a partnership between our companies. After researching your organization and understanding our mutual goals, I believe there may be opportunities for collaboration that could benefit both parties.

I would welcome the opportunity to discuss this further at your earliest convenience. Please let me know a suitable time for a call or meeting.

Looking forward to the possibility of working together.

Best regards,"
Submission of RFP Response ,"Dear John,

I trust this email finds you well. We are pleased to submit our response to the Request for Proposal (RFP) for [project name or description]. We have carefully reviewed the requirements outlined in the RFP and believe that our proposal addresses them comprehensively while offering innovative solutions to meet your needs.

Attached, please find our complete proposal for your review. Should you have any questions or require further clarification on any aspect of our proposal, please do not hesitate to reach out to me directly.

Thank you for considering [Your Company Name] as a potential partner for this project.

Best regards,"
Follow-Up on Our Meeting ,"Dear Mike,

I hope this email finds you well. It was a pleasure meeting with you earlier today. I wanted to thank you for taking the time to discuss [topic of discussion]. It was insightful, and I appreciate the opportunity to learn more about [their company

As per our discussion, I will [action item or next steps]. Please feel free to reach out if you have any questions or require further information.

Looking forward to the possibility of working together.

Best regards, Cailre"
Confirmation of Proposal Submission ,"Dear John,

I hope this email finds you well. I wanted to inform you that we have successfully submitted the proposal for [project or opportunity] as discussed. We believe our proposal encapsulates the essence of our capabilities and how we can contribute to [their company].

Please don't hesitate to contact me if you require any additional information or clarification regarding the proposal.

Thank you for considering our proposal.

Best regards,"
Request for Information on   ,"Dear John,

I hope you're doing well. I am writing to request more information about [specific product] offered by your company. We are currently evaluating potential solutions for [specific need or problem], and your product seems to align with our requirements.

Could you please provide details regarding features? Additionally, any case studies or testimonials would be greatly appreciated.

Thank you in advance for your assistance.

Best regards,"
Inquiry Regarding Potential Partnership ,"Dear John,

I hope this email finds you well. I am reaching out to explore the possibility of a partnership between our companies. After researching your organization and understanding our mutual goals, I believe there may be opportunities for collaboration that could benefit both parties.

I would welcome the opportunity to discuss this further at your earliest convenience. Please let me know a suitable time for a call or meeting.

Looking forward to the possibility of working together.

Best regards,"
Submission of RFP Response for [Project Name] ,"Dear John,

I trust this email finds you well. We are pleased to submit our response to the Request for Proposal (RFP) for [project name or description]. We have carefully reviewed the requirements outlined in the RFP and believe that our proposal addresses them comprehensively while offering innovative solutions to meet your needs.

Attached, please find our complete proposal for your review. Should you have any questions or require further clarification on any aspect of our proposal, please do not hesitate to reach out to me directly.

Thank you for considering [Your Company Name] as a potential partner for this project.

Best regards,"
Request for Meeting to Discuss Sales ,"Dear John,

I hope this email finds you well. I would like to request a meeting to discuss [topic]. This is an important matter that requires collaboration from both of our teams, and I believe a face-to-face discussion would be beneficial in moving forward effectively.

Could we schedule a meeting sometime next week at your convenience? Please let me know your availability, and I will coordinate the logistics accordingly.

Looking forward to our discussion.

Best regards,"
Introducing Our Newest Team Member ,"Dear Team,

I am pleased to announce that [New Employee's Name] has joined our team as [New Employee's Position]. [He/She] brings [brief description of skills] to our company, and we are excited to have [him/her] on board.

Please join me in welcoming [New Employee's Name] to the team. I'm confident [he/she] will make valuable contributions to our success.

Best regards,"
Upcoming Deadline for [Task/Project] ,"Dear John,

I hope this email finds you well. I wanted to send a friendly reminder that the deadline for [task/project] is approaching on [deadline date]. It's important that we stay on track to ensure timely completion.

If you have any questions or need assistance, please don't hesitate to reach out to me or the relevant team members.

Thank you for your attention to this matter.

Best regards,"
